<?xml version="1.0" encoding="UTF-8"?>
<property xmlns="https://uwlib-mig.github.io/schemasProject/xsd/"
   xmlns:xsi="http://www.w3.org/2001/XMLSchema-instance" 
   xmlns:xs="http://www.w3.org/2001/XMLSchema"
   xsi:schemaLocation="https://uwlib-mig.github.io/schemasProject/xsd/
   https://uwlib-mig.github.io/schemasProject/xsd/properties_files.xsd">
   <uid>p45</uid>
   <labels>
      <platformIndependent>interviewee</platformIndependent>
      <dc>creator</dc>
   </labels>
   <uwRequired>
      <uwStandalone>yes</uwStandalone>
      <uwObject>yes</uwObject>
      <uwItem>no</uwItem>
   </uwRequired>
   <cdm>
      <label>Interviewee</label>
      <cdmDatatype>text</cdmDatatype>
      <cdmLarge>no</cdmLarge>
      <searchable>yes</searchable>
      <hidden>no</hidden>
      <cdmRequired>no</cdmRequired>
      <cdmControlledVocab>no</cdmControlledVocab>
   </cdm>
   <dspace>
      <dspaceProperty/>
   </dspace>
   <descriptions>
      <definition>
         <para>A person interviewed.</para>
      </definition>
      <instructions co="no">
         <para>Enter the name of of person interviewed.</para>
         <para>Format of personal name: Lastname, Firstname.</para>
         <para>Use LC Name Authority File for form of name when available: http://authorities.loc.gov or http://id.loc.gov/</para>
         <para>Separate multiple values with a semicolon.</para>
      </instructions>
      <instructions co="object">
         <para>Enter the name of of person interviewed.</para>
         <para>Format of personal name: Lastname, Firstname.</para>
         <para>Use LC Name Authority File for form of name when available: http://authorities.loc.gov or http://id.loc.gov/</para>
         <para>Separate multiple values with a semicolon.</para>
      </instructions>
      <customization co="object" dd="p16786coll3" resourceType="oh">
         <para>Provide the name of the interviewee.</para>
         <para>When appropriate, search the &lt;a href="https://id.loc.gov/authorities/names.html"&gt;Library of Congress Name Authority File&lt;/a&gt; via id.loc.gov for the interviewee name.</para>
         <para>If a potential match is found, confirm that it is the person associated with the resource. It may be helpful to review information included in the web display such as source(s) of information and occupation (for persons), and/or to follow the links provided for exact and/or closely matching concepts from other schemes.</para>
         <para>Copy the name string for use just as it appears at the top of the page, above the URI(s), including dates.</para>
         <para>If no record exists, record personal names as "Lastname, Firstname".</para>
         <para>When recording names without a match in the NAF, reuse the recorded form consistently when the same person or organization appears in the metadata for a different resource.</para>
         <para>For a personal name like Alexander Ben Guiat, "Ben" is considered part of the first name and is transcribed as: "Guiat, Alexander Ben".</para>
         <para>Separate multiple entries with a semicolon and space (“; “).</para>
         <para>Order of values does not matter.</para>
      </customization>
      <customization co="object" dd="temp_alias_001" resourceType="default">
         <para>Enter the name of person(s) interviewed.</para>
         <para>&lt;br/&gt;</para>
         <para>Format personal names as follows:</para>
         <para>[Last Name], [English First Name] [Japanese First Name] [(Maiden name)*]</para>
         <para>*Include a maiden name if provided. Put the maiden name in parentheses.</para>
         <para>Separate multiple values with semicolons.</para>
         <para>&lt;br/&gt;</para>
         <para>UW Libraries cataloging staff: Retain name information entered by project metadata creators; do not replace with LCNAF forms of name.</para>
      </customization>
   </descriptions>
   <examples>
      <example co="object">
         <para>Kinsey, Clark</para>
         <para>Daiber, Ome</para>
         <para>Daiber, Ome; Armstrong, Calvin</para>
         <para>Colbert, Curt, 1947- </para>
         <para>Boeing Company. Boeing Military Aircraft and Missile Systems Group</para>
      </example>
      <example co="all">
         <para>Boyd and Braas</para>
      </example>
      <customization co="no" dd="neareast">
         <para>Noegel, Scott B.</para>
      </customization>
      <customization co="object" dd="uwtoh">
         <para>Honey, Michael K.</para>
         <para>Ellis, Joe, 1947-</para>
      </customization>
      <customization co="object" dd="p16786coll3" resourceType="oh">
         <para>Maimon, Solomon</para>
      </customization>
      <customization co="object" dd="temp_alias_001" resourceType="default">
         <para>Hattori, Fumi (Sato)</para>
         <para>Hayashi, June Mieko (Shirozu)</para>
         <para>Takasugi, Robert Mitsuhiro</para>
      </customization>
   </examples>
   <additionalInfo>
      <admin co="all" dd4para="p16786coll3">
         <para>Default is controlled-vocabulary feature OFF, Sephardic Studies Digital Collection - p16786coll3 requesting ON.</para>
      </admin>
   </additionalInfo>
   <marc>
      <dcgMarcMapping/>
      <marcNotes/>
   </marc>
   <xsd>
      <typeInfo level="standalone object">
         <typeAttribute>xs:string</typeAttribute>
      </typeInfo>
      <typeInfo level="item">
         <empty/>
      </typeInfo>
   </xsd>
   <rdf>
      <sameAs/>
   </rdf>
   <history>
      <dateCreated>
         <range>
            <start>2012-01-01</start>
            <end>2018-03-21</end>
         </range>
      </dateCreated>
      <created4Coll>Special Collections Oral History Collections</created4Coll>
      <justification>Every oral history that involves an interview has an interviewer. Special Collections believed the interview should be described and indexed./</justification>
      <changeLog>
         <change/>
      </changeLog>
   </history>
</property>
