<?xml version="1.0" encoding="UTF-8"?>
<property xmlns="https://uwlib-mig.github.io/schemasProject/xsd/"
   xmlns:xsi="http://www.w3.org/2001/XMLSchema-instance" 
   xmlns:xs="http://www.w3.org/2001/XMLSchema"
   xsi:schemaLocation="https://uwlib-mig.github.io/schemasProject/xsd/
   https://uwlib-mig.github.io/schemasProject/xsd/properties_files.xsd">
   <uid>p29</uid>
   <labels>
      <platformIndependent>digitalFormat</platformIndependent>
      <dc>format</dc>
   </labels>
   <uwRequired>
      <uwStandalone>no</uwStandalone>
      <uwObject>no</uwObject>
      <uwItem>no</uwItem>
   </uwRequired>
   <cdm>
      <label>Digital Format</label>
      <cdmDatatype>text</cdmDatatype>
      <cdmLarge>no</cdmLarge>
      <searchable>yes</searchable>
      <hidden>no</hidden>
      <cdmRequired>no</cdmRequired>
      <cdmControlledVocab>no</cdmControlledVocab>
   </cdm>
   <dspace>
      <dspaceProperty/>
   </dspace>
   <descriptions>
      <definition>
         <para>File format of a digital resource.</para>
      </definition>
      <instructions co="item">
         <para>Enter the file format of the access item.</para>
         <para>Use media types listed at &lt;a href="http://www.iana.org/assignments/media-types/index.html"&gt;http://www.iana.org/assignments/media-types/index.html&lt;/a&gt;.</para>
         <para>For audio WAVE files, enter "audio/wav".</para>
      </instructions>
      <!-- MIG decision 2020-05: do not include this property in the object description
         <instructions co="object">
         <para>Enter the file formats of the access items.</para>
         <para>Use media types listed at http://www.iana.org/assignments/media-types/index.html</para>
         <para>For audio WAVE files, enter audio/wav.</para>
      </instructions>-->
      <instructions co="no">
         <para>Enter the file format of the access item.</para>
         <para>Use media types listed at &lt;a href="http://www.iana.org/assignments/media-types/index.html"&gt;http://www.iana.org/assignments/media-types/index.html&lt;/a&gt;.</para>
         <para>For audio WAVE files, enter "audio/wav".</para>
      </instructions>
      <customization co="item" dd="p16786coll3" resourceType="oh song text">
         <para>Enter the file format of the file representing the compound-object item--that is, the access item.</para>
         <para>This should be the format of the file given as a value for the digitalFileName property.</para>
         <para>Use media types listed at &lt;a href="http://www.iana.org/assignments/media-types/index.html"&gt;http://www.iana.org/assignments/media-types/index.html&lt;/a&gt;.</para>
         <para>For audio WAVE files, enter "audio/wav".</para>
      </customization>
      <customization co="item" dd="greekdancing" resourceType="default">
         <para>Enter the file format of the compound-object item (video file or table of contents).</para>
         <para>&lt;br/&gt;For .mp4 files enter the following:</para>
         <para>video/mp4</para>
         <para>&lt;br/&gt;For .pdf files enter the following:</para>
         <para>application/pdf</para>
      </customization>
      <customization co="item" dd="temp_alias_001" resourceType="default">
         <para>Enter the file format of the compound-object item.</para>
         <para>This should be the format of the file given as a value for the Original File Name property.</para>
         <para>Use media type values from the &lt;a href="http://www.iana.org/assignments/media-types/index.html"&gt;IANA media types registries&lt;/a&gt;.</para>
         <para>For audio WAVE files, use "audio/wav".</para>
      </customization>
   </descriptions>
   <examples>
      <example co="item">
         <para>audio/mpeg</para>
         <para>image/jpeg</para>
         <para>application/pdf</para>
         <para>text/plain</para>
         <para>video/mp4</para>
      </example>
      <example co="no">
         <para>audio/mpeg</para>
         <para>image/jpeg</para>
         <para>application/pdf</para>
         <para>text/plain</para>
         <para>video/mp4</para>
      </example>
      <customization co="item" dd="greekdancing" resourceType="default">
         <para>video/mp4</para>
         <para>application/pdf</para>
      </customization>
      <!-- MIG decision 2020-05: do not include this property in the object description
      <example co="object">
         <para>video/mp4; application/pdf</para>
      </example>-->
      <customization co="item" dd="temp_alias_001" resourceType="default">
         <para>video/mp4</para>
         <para>audio/mpeg</para>
         <para>audio/wav</para>
         <para>application/pdf</para>
      </customization>
   </examples>
   <additionalInfo/>
   <marc>
      <dcgMarcMapping/>
      <marcNotes>
         <para/>
      </marcNotes>
   </marc>
   <xsd>
      <typeInfo level="item">
         <typeAttribute>xs:string</typeAttribute>
      </typeInfo>
   </xsd>
   <rdf>
      <owlDatatypeProperty>yes</owlDatatypeProperty>
   </rdf>
   <history>
      <dateCreated>
         <single>2012-01-01</single>
      </dateCreated>
      <created4Coll>Special Collections Oral Histories Collections</created4Coll>
      <justification>Special Collections wanted a place to describe the file format of the service copy of the resource..</justification>
      <changeLog>
         <change date="2019-04-22">Added instructions and example for @co="no"</change>
         <change date="2019-05-20">//rdf/owlDatatypeProperty='yes' to push into DCMI 1.1 namespace.</change>
         <change date="2020-06-03">removed object description in accordance with MIG decision.</change>
         <change date="2021-10-23">Encode URL in instructions for output to HTML as a link.</change>
         <change date="2021-10-23">Add custom instructions for SSDC coitems.</change>
         <change date="2022-07-28">Add guidance/examples for Tacoma Japanese Language School Project - temp_alias_001</change>
      </changeLog>
   </history>
</property>
