<?xml version="1.0" encoding="UTF-8"?>
<property xmlns="https://uwlib-mig.github.io/schemasProject/xsd/"
   xmlns:xsi="http://www.w3.org/2001/XMLSchema-instance" 
   xmlns:xs="http://www.w3.org/2001/XMLSchema"
   xsi:schemaLocation="https://uwlib-mig.github.io/schemasProject/xsd/
   https://uwlib-mig.github.io/schemasProject/xsd/properties_files.xsd">
   <uid>p30</uid>
   <labels>
      <platformIndependent>digitalIdNumber</platformIndependent>
      <dc>identifier</dc>
   </labels>
   <uwRequired>
      <uwStandalone>yes</uwStandalone>
      <uwObject>yes</uwObject>
      <uwItem>no</uwItem>
   </uwRequired>
   <cdm>
      <label>Digital ID Number</label>
      <cdmDatatype>text</cdmDatatype>
      <cdmLarge>no</cdmLarge>
      <searchable>yes</searchable>
      <hidden>no</hidden>
      <cdmRequired>no</cdmRequired>
      <cdmControlledVocab>no</cdmControlledVocab>
   </cdm>
   <dspace>
      <dspaceProperty/>
   </dspace>
   <descriptions>
      <definition>
         <para>Unique number assigned to each digital object in CONTENTdm for identification purposes.</para>
      </definition>
      <instructions co="no">
         <para>Enter the order number.</para>
         <para>Order number sequence must be obtained from appropriate staff.</para>
      </instructions>
      <instructions co="object">
         <para>Enter the order number.</para>
         <para>Order number sequence must be obtained from appropriate staff.</para>
      </instructions>
      <instructions co="item">
         <para>Enter the order number.</para>
         <para>Order number sequence must be obtained from appropriate staff.</para>
      </instructions>
      <customization co="object" dd="temp_alias_001" genre_form="default">
         <para>Do not enter values for Digital ID Number.</para>
         <para>Digital ID Numbers will be assigned by ITS-DS staff when resources and metadata are loaded to the collection.</para>
      </customization>
      <customization co="item" dd="temp_alias_001" genre_form="default">
         <para>Do not enter values for Digital ID Number.</para>
         <para>Digital ID Numbers will be assigned by ITS-DS staff when resources and metadata are loaded to the collection.</para>
      </customization>
      <customization co="no" dd="becker" genre_form="*">
         <para>Do not enter values for Digital ID Number.</para>
         <para>Digital ID Numbers will be assigned by ITS-DS staff when resources and metadata are loaded to the collection.</para>
      </customization>
   </descriptions>
   <examples>
      <example co="no">
         <para>CVW051</para>
         <para>COS321</para>
         <para>ARC0443</para>
      </example>
      <example co="object">
         <para>OHC0847</para>
      </example>
      <example co="item">
         <para>OHC0847-Audio</para>
         <para>OHC084-Transcript</para>
         <para>OHC084-Video</para>
      </example>
      <customization co="object" dd="uwtoh">
         <para>OWTOH201701</para>
         <para>OWTOH201702</para>
      </customization>
      <customization co="item" dd="uwtoh">
         <para>OWTOH201802-Audio</para>
         <para>UWTOH201802-Image</para>
         <para>UWTOH201802-Transcript</para>
      </customization>
      <customization co="object" dd="temp_alias_001" genre_form="default">
         <para>OHC0676</para>
         <para>OHC0010</para>
      </customization>
      <customization co="item" dd="temp_alias_001" genre_form="default">
         <para>OHC0676-Video</para>
         <para>OHC0676-Transcript</para>
         <para>OHC0010-Audio-01</para>
         <para>OHC0010-Audio-02</para>
         <para>OHC0010-Transcript</para>
      </customization>
   </examples>
   <additionalInfo>
      <admin co="no">
         <para>Photograph collections also have this property but it is labeled "Order Number."</para>
      </admin>
   </additionalInfo>
   <marc>
      <dcgMarcMapping/>
      <marcNotes>
         <para/>
      </marcNotes>
   </marc>
   <xsd>
      <typeInfo level="standalone object">
         <simpleType>
            <xs:restriction base="xs:string">
               <xs:minLength value="1"/>
            </xs:restriction>
         </simpleType>
      </typeInfo>
      <typeInfo level="item">
         <typeAttribute>xs:string</typeAttribute>
      </typeInfo>
   </xsd>
   <rdf> </rdf>
   <history>
      <dateCreated>
         <range>
            <start>2012-01-01</start>
            <end>2018-03-23</end>
         </range>
      </dateCreated>
      <created4Coll>Special Collections Oral Histories Collections</created4Coll>
      <justification>Special Collections wants a identifier for each object in CONTENTdm</justification>
      <changeLog>
         <change date="2022-07-27">Add custom guidance and examples for Tacoma Japanese Language School Project - temp_alias_001 - these may be broadly applicable, as present plan is for ITS-DS to assign these values, not collection managers</change>
      </changeLog>
   </history>
</property>
